{
  "schema_version": "0.2",
  "name": "Claude Code Monitor",
  "datasources": [
    {
      "id": "claude",
      "type": "push",
      "stale_after_sec": 600,
      "fields": [
        "session_pct", "session_reset_in_sec", "session_valid",
        "week_pct", "week_reset_in_sec", "week_valid"
      ]
    },
    {
      "id": "clock",
      "type": "internal",
      "source": "clock",
      "tz": "CET-1CEST,M3.5.0,M10.5.0/3"
    }
  ],
  "pages": [
    {
      "id": "active",
      "show_when": "!claude.__stale",
      "rotation": 90,
      "bg": "#111111",
      "widgets": [
        { "type": "label", "x": 16,  "y": 8,   "text": "Claude Code", "font": 24, "color": "#EEEEEE" },

        { "type": "label", "x": 16,  "y": 50,  "text": "Session",     "font": 16, "color": "#888888" },
        { "type": "label", "x": 304, "y": 46,  "binding": "claude.session_pct", "format": "{:.0f}%", "font": 20, "color": "#D95A12", "align": "right" },
        { "type": "bar",   "x": 16,  "y": 76,  "w": 288, "h": 14, "binding": "claude.session_pct", "min": 0, "max": 100, "color": "#D95A12", "bg": "#2A2A2A" },
        { "type": "label", "x": 16,  "y": 96,  "binding": "claude.session_reset_in_sec", "format": "resets in {duration}", "font": 12, "color": "#888888" },

        { "type": "label", "x": 16,  "y": 130, "text": "Week",        "font": 16, "color": "#888888" },
        { "type": "label", "x": 304, "y": 126, "binding": "claude.week_pct", "format": "{:.0f}%", "font": 20, "color": "#D95A12", "align": "right" },
        { "type": "bar",   "x": 16,  "y": 156, "w": 288, "h": 14, "binding": "claude.week_pct", "min": 0, "max": 100, "color": "#D95A12", "bg": "#2A2A2A" },
        { "type": "label", "x": 16,  "y": 176, "binding": "claude.week_reset_in_sec", "format": "resets in {duration}", "font": 12, "color": "#888888" },

        { "type": "label", "x": 16,  "y": 222, "binding": "clock.hhmm", "font": 14, "color": "#888888" }
      ]
    },
    {
      "id": "idle",
      "show_when": "claude.__stale",
      "bg": "#111111",
      "widgets": [
        { "type": "image", "x": 0, "y": 28, "src": "builtin:claude-logo" },
        { "type": "label", "x": 211, "y": 173, "text": "▁▁▁▁", "font": 24, "color": "#D95A12", "blink": true, "blink_interval_ms": 530 },

        { "type": "line",  "x1": 0,  "y1": 210, "x2": 320, "y2": 210, "color": "#1B1B1B", "thickness": 1 },
        { "type": "label", "x": 16,  "y": 218, "binding": "claude.session_reset_in_sec", "format": "session {duration}", "font": 14, "color": "#888888" },
        { "type": "label", "x": 304, "y": 218, "binding": "claude.week_reset_in_sec",    "format": "week {duration}",    "font": 14, "color": "#888888", "align": "right" }
      ]
    }
  ]
}
